{
  "schema_version": "catalyst.backtest.market_data_bundle.v1",
  "interval": "1h",
  "start": "2024-01-01T00:00:00Z",
  "end": "2024-01-01T02:00:00Z",
  "candles": [
    {
      "venue": "hyperliquid",
      "symbol": "ETH",
      "quote": "USD",
      "points": [
        { "ts": "2024-01-01T00:00:00Z", "open": "2000", "high": "2010", "low": "1990", "close": "2005", "volume": "1500" },
        { "ts": "2024-01-01T01:00:00Z", "open": "2005", "high": "2050", "low": "1850", "close": "1800", "volume": "2200" }
      ]
    }
  ],
  "funding": [
    {
      "venue": "hyperliquid",
      "symbol": "ETH",
      "points": [
        { "ts": "2024-01-01T00:00:00Z", "rate": "0.0001" },
        { "ts": "2024-01-01T01:00:00Z", "rate": "-0.00005" }
      ]
    }
  ],
  "gas": [
    {
      "chain": "base",
      "points": [{ "ts": "2024-01-01T00:00:00Z", "gas_usd": "0.02" }]
    }
  ],
  "yields": [
    {
      "protocol": "aave",
      "pool": "usdc",
      "asset": "USDC",
      "chain": "base",
      "points": [{ "ts": "2024-01-01T00:00:00Z", "apr": "0.045" }]
    }
  ],
  "providers": [
    { "name": "fixture", "kind": "candles", "coverage": { "start": "2024-01-01T00:00:00Z", "end": "2024-01-01T02:00:00Z", "complete": true } }
  ],
  "warnings": []
}
